,person,role,organisation,company_summary,source_text,organisation_type,industry_domain,functional_expertise
41,Chris Gorell Barnes,Founding Partner,Ocean 14 Capital,"Ocean 14 Capital (O14C) is a leading private equity growth firm in the blue economy. They focus on transforming late-stage venture and growth ocean businesses into data-led, technology-enabled, circular, and regenerative industrial scale platforms. Their recent fund, Ocean 14 Capital Fund I, has closed at €201 million and is dedicated to funding sustainable solutions to improve ocean health in the blue economy sector.","[0] Ocean 14 Capital | Transforming the blue economy (https://ocean14capital.com/) [1] Ocean 14 Capital Fund I reaches hard cap of €200 million providing ... (https://ocean14capital.com/2024/05/10/ocean-14-capital-fund-i-reaches-hard-cap-of-e200-million-providing-transformative-investment-into-the-global-blue-economy/) [2] Ocean 14 Capital Ltd. announces B Corp™ certification, recognising its ... (https://ocean14capital.com/2024/02/21/ocean-14-capital-ltd-announces-b-corp-certification-recognising-its-commitment-to-investments-in-and-care-for-the-ocean/) [3] UK-based Ocean 14 Capital Fund closes €200M to support the blue economy ... (https://techfundingnews.com/uk-based-ocean-14-capital-fund-closes-e200m-to-support-the-blue-economy/) [4] Ocean 14: bringing global capital to the sustainable blue economy (https://thefishsite.com/articles/ocean-14-combining-marine-conservation-with-hefty-global-capital)",private equity growth firm,blue economy,"transforming ocean businesses into data-led, technology-enabled, circular, and regenerative platforms"
42,Chris Slater,Founder & CEO,"Oka, The Carbon Insurance Company","Oka, The Carbon Insurance Company in the UK provides insurance solutions to de-risk carbon credits in both the voluntary and compliance markets. Their pioneering carbon insurance offerings aim to protect credit holders against unforeseeable events, supporting buyers and sellers in the evolving carbon credit market. Oka aims to scale market growth and accelerate climate action by providing financial compensation in the event of post-issuance risks, such as reversal and invalidation, ultimately contributing to the pathway to Net Zero.","[0] Home - Oka, The Carbon Insurance Company (https://carboninsurance.co/) [1] About Us - Oka, The Carbon Insurance Company (https://carboninsurance.co/about-us/) [2] Oka, Why We're Here - Oka, The Carbon Insurance Company (https://carboninsurance.co/oka-why-were-here/) [3] Oka, The Carbon Insurance Company | LinkedIn (https://uk.linkedin.com/company/oka-the-carbon-insurance-company) [4] Carbon Credit Insurance Startup Oka Launches with $7 Million Seed ... (https://www.esgtoday.com/carbon-credit-insurance-startup-oka-launches-with-7-million-seed-funding/)",startup,carbon credits and insurance,insurance solutions for carbon credit risks
43,Chris Smith,Founder & CEO,Meld Energy,"Meld Energy is a UK-based energy start-up backed by World Fuel Services, a Fortune 500 company. They are focused on developing green hydrogen projects, with plans to build a £180 million green hydrogen plant near Hull. This project aims to accelerate decarbonization efforts in the region and is part of Meld Energy's larger goal to bring forward multiple green hydrogen projects in the Humber and across the UK. The company has received approval to construct a 100-megawatt green hydrogen production facility in the UK, with work set to begin in 2026 and operations expected to start towards the end of 2028.",[0] Home - Meld Energy (https://meld.energy/) [1] About Us - Meld Energy (https://meld.energy/about-us/) [2] Meld Energy has received approval to construct a 100 megawatt green ... (https://hydrogenwire.com/2024/06/17/meld-energy-has-received-approval-to-construct-a-100-megawatt-green-hydrogen-production-facility-in-uk/) [3] Projects - Meld Energy (https://meld.energy/projects/) [4] UK's Meld Energy gets permit for 100-MW green hydrogen project (https://renewablesnow.com/news/uks-meld-energy-gets-permit-for-100-mw-green-hydrogen-project-860670/),energy start-up,green hydrogen,decarbonization projects and hydrogen production
44,Christian Arno,Founder,Pawprint,"Pawprint in the UK is a Climate Action Platform founded in 2017 by Christian Arno. It aims to help businesses become net zero by 2050 by empowering employees to measure, understand, and reduce their carbon footprint. The platform enables businesses to track live carbon reduction of employee actions, collect GHG Protocol aligned data, and benchmark progress towards climate goals. Pawprint encourages a shift towards sustainable business practices that prioritize profit and growth without harming people or the planet.",[0] Our Impact | Pawprint (https://www.pawprint.eco/our-impact) [1] Pawprint | Embed Sustainability Faster Through Employees (https://www.pawprint.eco/) [2] Why Pawprint | The corporate climate action platform (https://www.pawprint.eco/why-pawprint) [3] 76. Pawprint - Startups 100 2023 | Startups.co.uk (https://startups.co.uk/startups-100/2023/pawprint/) [4] Royal London becomes first mutual company to use Pawprint for Business (https://www.royallondon.com/about-us/media/media-centre/press-releases/press-releases-2021/november/royal-london-becomes-first-mutual-company-to-use-pawprint-for-business/),Climate Action Platform,Sustainability and Carbon Management,"Carbon footprint measurement and reduction, GHG Protocol data collection, benchmarking for climate goals"
45,Christian Hernandez,Partner,2150,"2150 in the UK is a venture capital firm founded in 2019, based in London. They focus on investing in various sectors including B2B, energy, financial services, information technology, SaaS, artificial intelligence, clean technology, climate technology, construction technology, cryptocurrency, financial technology, infrastructure, and mobility technology. The firm aims to support tech entrepreneurs with 'Constructive Capital' to create companies that benefit billions of people, generate commercial value, and have a positive environmental impact. They have a mission to deploy sustainable investments for superior returns and meaningful impact, particularly in addressing today's challenges such as reducing the carbon footprint of cities.",[0] Constructive Capital for Urban Tech - 2150.vc (https://www.2150.vc/) [1] 2150 Investor Profile: Portfolio & Exits | PitchBook (https://pitchbook.com/profiles/investor/342956-80) [2] Impact - 2150.vc (https://www.2150.vc/impact/) [3] 2150 launches with $240M fund to reduce the carbon footprint of the ... (https://techcrunch.com/2021/02/23/2150-launches-with-281m-fund-to-reduce-the-carbon-footprint-of-the-worlds-growing-cities/) [4] Manifesto - 2150.vc (https://www.2150.vc/manifesto/),venture capital firm,investment across various sectors including technology and clean energy,supporting tech entrepreneurs with sustainable investments and Constructive Capital
46,Christophe Williams,Co-founder & CEO,Naked Energy,"Naked Energy in the UK is a solar tech company that focuses on decarbonizing heat generation. Recently, it secured GBP 17 million in new equity funding to support its growth and global expansion efforts. The investment was led by E.ON and supported by Barclays. Naked Energy's mission is to change energy for good by providing high energy density solutions capable of cost-effectively decarbonizing heat with limited space, specifically through its solar PVT technology.","[0] Naked Energy secures GBP 17 million of new equity (https://www.pv-magazine.com/2024/07/15/naked-energy-secures-gbp-17-million-of-new-equity/) [1] UK solar tech scaleup Naked Energy raises £17M for global expansion - TNW (https://thenextweb.com/news/uk-solar-tech-naked-energy-raises-17m-global-expansion) [2] UK solar heat firm Naked Energy raises GBP 17m in funding led by E.on (https://renewablesnow.com/news/uk-solar-heat-firm-naked-energy-raises-gbp-17m-in-funding-led-by-eon-863489/) [3] British solar innovator Naked Energy opens £30m funding round (https://nakedenergy.com/pressreleases/british-solar-innovator-naked-energy-opens-30m-funding-round) [4] Naked Energy, a UK Solar Heat Firm, Secures £17 Million in Funding Led ... (https://www.energy-box.com/post/naked-energy-a-uk-solar-heat-firm-secures-17-million-in-funding-led-by-e-on)",solar technology company,decarbonization of heat generation,solar PVT technology
47,Clarisse Beurrier,Co-Founder & Director,Cellcraft Ltd.,"Cellcraft Ltd. in the UK is a biotechnology startup based in the University of Cambridge that focuses on developing scalable Cultivated Meat production systems to address global food security and sustainability challenges. They work on specialized processes, enabling technologies, software, hardware, and raw materials for Cultivated Meat production.",[0] About us - cellcraft.com (https://www.cellcraft.com/about-us) [1] Cellcraft (https://www.cellcraft.com/) [2] Cellcraft | LinkedIn (https://uk.linkedin.com/company/cellcraft) [3] CellCraft secure £737k in R&D grant funding | Venturenomix (https://venturenomix.co.uk/cellcraft-secure-737k-in-rd-grant-funding/) [4] £15.6 million boost for low-emission food production systems (https://www.ukri.org/news/15-6-million-boost-for-low-emission-food-production-systems/),biotechnology startup,cultivated meat production,"scalable production systems, enabling technologies, software, hardware, and raw materials for cultivated meat"
48,Conor Hamil,Co-CEO,Nuada,"Nuada in the UK is a vertically integrated carbon capture company that aims to decarbonize hard-to-abate sectors through their next-generation carbon capture technology. They deploy energy-efficient filtration machines to make carbon capture commercially viable and pave the path for zero carbon emissions in industry. Nuada has been receiving investments to support the construction of pilot projects and additional pilot plants in the UK, showcasing the versatility of their technology.",[0] We are Nuada - A Purpose-Driven Carbon Capture Company (https://nuadaco2.com/about/) [1] Nuada: £3.4m investment for NI green technology firm - BBC (https://www.bbc.com/news/uk-northern-ireland-66313144) [2] Belfast's Nuada bags £3.4m for its carbon capture tech (https://www.siliconrepublic.com/start-ups/nuada-funding-bgf-carbon-capture-startup-belfast-northern-ireland) [3] BGF invests £3.4m into innovative carbon capture business Nuada (https://www.irishnews.com/business/2023/07/27/news/bgf_invests_3_4m_into_innovative_carbon_capture_business_nuada-3471598/) [4] Nuada Carbon Capture - Ultra Energy Efficient CO2 Capture (https://nuadaco2.com/),carbon capture company,decarbonization of hard-to-abate sectors,next-generation carbon capture technology and energy-efficient filtration systems
49,Daniel Burton,Group CEO,Wondrwall,"Wondrwall in the UK provides the world's first intelligent home automation system that converts standard homes into intelligent homes. Their system controls heating, lighting, security, safety, music, and offers voice control, all in a single integrated solution. It monitors living patterns and home performance to automatically enhance safety, security, and reduce energy bills. Additionally, Wondrwall Energy combines their intelligent home automation system with battery storage, solar panels, and a hybrid inverter to provide a comprehensive home energy management solution.","[0] Wondrwall | Convert standard homes into intelligent homes (https://wondrwall.co.uk/) [1] Wondrwall Intelligent Heating Control | Wondrwall (https://wondrwall.co.uk/wondrwall-intelligent-heating-control/) [2] Five questions for Daniel Burton, founder & CEO of Wondrwall (https://moneyweek.com/481339/five-questions-for-daniel-burton-founder-ceo-of-wondrwall) [3] Energy | Wondrwall (https://wondrwall.co.uk/energy/) [4] Wondrwall Group (t/a Wondrwall) secures £100 million investment from ... (https://www.uktechnews.info/2023/12/05/wondrwall-group-t-a-wondrwall-secures-100-million-investment-from-infrared-capital-partners/)",technology company,home automation and energy management,"intelligent home systems, energy efficiency, and automation technology"
50,Daniel Mitchell,CEO,addvantage Global Ltd,"addvantage Global Ltd in the UK develops and tests a hybrid dual-fuel technology aimed at reducing fuel costs and emissions for heavy-duty truck fleet operators. This technology involves injecting a precise amount of LPG (propane) pre-combustion to create a mix of diesel, air, and LPG, extending trucks' range by up to 20% and reducing CO2 emissions by 23%. The company emphasizes integrity, safety, quality, customer service excellence, and teamwork in all aspects of its business operations.","[0] UK - addvantage Global (https://www.addvantageglobal.com/uk/) [1] About UK - addvantage Global (https://www.addvantageglobal.com/uk/about/) [2] About - addvantage Global (https://www.addvantageglobal.com/about/) [3] addvantage Global Company Profile 2024: Valuation, Funding ... - PitchBook (https://pitchbook.com/profiles/company/267746-59) [4] ADDVANTAGE GLOBAL LIMITED - Dun & Bradstreet (https://www.dnb.com/business-directory/company-profiles.addvantage_global_limited.148e54095126ff19734a79da743533ab.html)",technology company,transportation and logistics,hybrid dual-fuel technology development and testing
51,Dan Travers,Co-Founder,Open Climate Fix,"Open Climate Fix in the UK is a non-profit product lab focused on reducing greenhouse gas emissions rapidly. They collaborate with organizations like the European Space Agency, National Grid Electricity System Operator, and Google.org to improve machine learning for forecasting PV power generation using satellite images. They also develop AI solutions to help the electricity grid transition to 100% renewable power generation, with a particular focus on solar forecasting products.",[0] What We Do | Open Climate Fix (https://www.openclimatefix.org/what-we-do) [1] Our Story | Open Climate Fix (https://www.openclimatefix.org/story) [2] Open Climate Fix (https://www.openclimatefix.org/) [3] Open Climate Fix | LinkedIn (https://uk.linkedin.com/company/open-climate-fix) [4] Home | Open Climate Fix (https://old.openclimatefix.org/),non-profit product lab,greenhouse gas emissions reduction,machine learning for forecasting PV power generation and AI solutions for renewable energy transition
52,Dr Daniel Stewart,Co-Founder & CEO,ViridiCO2 Ltd,"ViridiCO2 Ltd in the UK specializes in developing technology that helps chemical manufacturers reduce fossil fuel usage by utilizing captured carbon dioxide. The company has recently raised £3 million in seed funding to accelerate the development and commercialization of their technology, which aims to convert waste carbon dioxide into valuable chemical products such as surfactants, polymer feedstocks, and small molecules.","[0] ViridiCO2 - utilising CO2 to save our planet (https://viridico2.co.uk/) [1] ViridiCO2: Climate Tech Startup Lands $3.5 Million Seed Round From EQT ... (https://www.businessinsider.com/pitch-deck-startup-viridico2-3-million-convert-carbon-chemicals-2023-3?op=1) [2] Carbon conquering company gains major funding boost and international ... (https://www.southampton.ac.uk/news/2023/03/viridico2-investment-forbes.page) [3] ViridiCO2 Company Profile 2024: Valuation, Funding & Investors - PitchBook (https://pitchbook.com/profiles/company/461989-72) [4] ViridiCO2 raises £3m in Seed funding to develop sustainable chemical ... (https://tech.eu/2023/03/07/viridico2-secures-ps3m-in-seed-funding-to-make-chemical-products-from-co2/)",startup,sustainable chemicals,carbon capture and utilization technology
53,David Contreras,Co-Founder,Zeru.Earth,"Zeru.Earth in the UK operates as a carbon dioxide removal (CDR) platform, focusing on addressing the quality issues of the voluntary carbon market. The company provides non-dilutive financing for CDR startups, offers high-quality CDR credits on the blockchain, and helps clients embed carbon removal into their daily operations. Additionally, Zeru.Earth offers a platform where individuals can take verifiable climate action daily through a fintech calculator that estimates carbon emissions from transactions.","[0] Zeru Earth Company Profile 2024: Valuation, Funding & Investors - PitchBook (https://pitchbook.com/profiles/company/512993-17) [1] Zeru.Earth | LinkedIn (https://www.linkedin.com/company/zeruearth) [2] Zeru.Earth on LinkedIn: In the quest for a sustainable future ... (https://www.linkedin.com/posts/zeruearth_in-the-quest-for-a-sustainable-future-zeruearth-activity-7140807744449568768-ZrFj) [3] Zeru.Earth on LinkedIn: #environmentaljustice #riverpollution # ... (https://www.linkedin.com/posts/zeruearth_environmentaljustice-riverpollution-protectourrivers-activity-7157859785537650689-Qnrc) [4] Zeru.Earth | LinkedIn (https://cl.linkedin.com/company/zeruearth)",carbon dioxide removal platform,voluntary carbon market,fintech solutions for carbon emissions estimation and blockchain-based carbon credits
54,David de Picciotto,CEO & Co-Founder,Pledge,"In the UK, the term ""pledge"" is often associated with declarations of loyalty and allegiance to the Crown, as seen in various contexts such as the oath of allegiance made by members of the UK Scout Association and the parliamentary oath taken by Members of the House of Commons and the House of Lords. These pledges typically involve commitments to duty, allegiance to the monarch, and adherence to the law.",[0] Oath of Allegiance (United Kingdom) - Wikipedia (https://en.wikipedia.org/wiki/Oath_of_Allegiance_(United_Kingdom)) [1] How to pledge allegiance to the King: The Homage of the People in full ... (https://inews.co.uk/news/pledge-allegiance-king-how-homage-people-full-meaning-explained-2321917) [2] Swearing in and the parliamentary oath - UK Parliament (https://www.parliament.uk/about/how/elections-and-voting/swearingin/) [3] Coronation: Read the full text of updated 'pledge of allegiance' to ... (https://www.independent.co.uk/life-style/royal-family/coronation-pledge-allegiance-charles-b2333811.html) [4] What does 'pledge allegiance to the King' mean? Historic coronation ... (https://inews.co.uk/news/pledge-allegiance-king-what-mean-coronation-oath-charles-iii-meaning-explained-2309124),government,public administration,legal and constitutional affairs
55,David Elliott,CEO,Future Forest Company,"The Future Forest Company in the UK is dedicated to planting trees, protecting nature, restoring peatland, and fighting climate change by removing carbon from the atmosphere. They work with businesses to help them achieve their sustainability goals through nature restoration projects, employee tree planting events, and UK reforestation initiatives.",[0] The Future Forest Company (https://thefutureforestcompany.com/) [1] What we do - The Future Forest Company (https://thefutureforestcompany.com/pages/what-we-do) [2] Our Story - The Future Forest Company (https://thefutureforestcompany.com/pages/our-story) [3] The Future Forest Company Reviews - glassdoor.co.uk (https://www.glassdoor.co.uk/Reviews/The-Future-Forest-Company-Reviews-E5898951.htm) [4] The Future Forest Company | LinkedIn (https://www.linkedin.com/company/the-future-forest-company),non-profit organization,environmental conservation,"carbon offsetting, reforestation, and nature restoration"
56,Dr David Kim,CEO & Founder,Cyanocapture,"CyanoCapture in the UK leverages synthetic biology to engineer bacteria that consume CO2 powered by light, with the aim of decarbonizing power stations, refineries, and fermentation systems. They bury excess biomass and bioproduct underground for carbon capture and storage, qualifying as true CCS. The company was founded in January 2021 and aims to provide affordable, long-term carbon capture on an industrial scale by using genetically modified cyanobacteria.",[0] Home | CyanoCapture (https://www.cyanocapture.com/) [1] Introducing CyanoCapture — The Oxford Bioescalator (https://www.bioescalator.ox.ac.uk/news/introducing-cyanocapture) [2] About | CyanoCapture (https://www.cyanocapture.com/about) [3] Student start-up CyanoCapture is a winner in $5m XPRIZE for carbon ... (https://www.mpls.ox.ac.uk/latest/news/student-start-up-cyanocapture-is-a-winner-in-5m-xprize-for-carbon-removal-projects) [4] CyanoCapture moves on from the BioEscalator (https://www.bioescalator.ox.ac.uk/news/cyanocapture-moves-on-from-the-bioescalator),startup,carbon capture and storage,synthetic biology and genetic engineering of cyanobacteria
57,Di Gilpin,Founder & CEO,Smart Green Shipping,"Smart Green Shipping in the UK develops technical, commercially viable, digitally enabled wind-powered solutions to accelerate the shipping industry's green transition. They focus on building and financing autonomous, retrofittable wind technologies like the FastRig, a 100% recyclable wingsail, to help reduce greenhouse emissions. The company aims to lead the global shipping industry's green transition through collaborations with industry partners and private investors, with targets to reduce greenhouse gas emissions and fuel costs by at least 20%.","[0] Smart Green Shipping (https://smartgreenshipping.com/) [1] Meet Smart Green Shipping, the startup using wind power to decarbonise ... (https://www.maddyness.com/uk/2023/09/12/meet-smart-green-shipping-the-startup-using-wind-power-to-decarbonise-the-shipping-industry/) [2] £5m Smart Green Shipping project set to turn the tide to make shipping ... (https://www.scottish-enterprise-mediacentre.com/news/gbp-5m-smart-green-shipping-project-set-to-turn-the-tide-to-make-shipping-20-percent-greener) [3] Shipping industry turns to high-tech wings for faster decarbonisation (https://www.ft.com/content/987e2cbe-65bb-455e-be57-cba662891c6f) [4] Smart Green Shipping (https://smartgreenshipping.com/news-1/2023/7/24/qmd04a4li75cifwx1or9rae15no1co)",startup,shipping and maritime,wind-powered technologies and green transition solutions
58,Dimitrios Theocharis,CEO,Ecologi,"Ecologi in the UK is a climate action platform that has evolved into a community of over 19,000 businesses and 40,000 members. They focus on championing SMEs as green revolutionaries, empowering them to reduce emissions and take climate action. The platform has funded the planting of millions of trees and the avoidance of millions of tonnes of CO2 emissions, making a significant impact on the environment.",[0] About Ecologi | Ecologi (https://ecologi.com/about) [1] Take real climate action with Ecologi® | Ecologi (https://ecologi.com/) [2] Take real climate action with Ecologi® | Ecologi (https://ecologi.com/pages/restoring-our-planet-together) [3] Bristol activists to plant millions of trees with investment - BBC (https://www.bbc.com/news/uk-england-bristol-57567929) [4] Bristol activists to plant millions of trees with investment (https://www.bbc.co.uk/news/uk-england-bristol-57567929),climate action platform,environmental sustainability,emission reduction and reforestation initiatives
59,Ed Asseily,CEO,Zulu Ecosystems,"Zulu Ecosystems in the UK is focused on responsibly regenerating natural ecosystems to enable the planet and its communities to thrive. They utilize proprietary technology and on-the-ground relationships to facilitate the regeneration of nature at scale, collaborating with landowners, investors, and communities. Their platform combines scientific rigor with advanced technologies like high-resolution satellite imagery and remote sensing to evaluate natural capital opportunities efficiently.",[0] Zulu Ecosystems (https://www.zuluecosystems.com/) [1] Zulu Ecosystems - National Biodiversity Network (https://nbn.org.uk/members/zulu-ecosystems/) [2] About us | Zulu Ecosystems - zuluforest.com (https://www.zuluecosystems.com/about-us) [3] Zulu Ecosystems | LinkedIn (https://uk.linkedin.com/company/zulu-ecosystems) [4] Zulu Forest Sciences is now Zulu Ecosystems | Zulu Ecosystems (https://www.zuluecosystems.com/newsroom/post),environmental consultancy,ecosystem regeneration,remote sensing and natural capital evaluation
60,Ed Craig,CEO,Carbogenics Limited,"Carbogenics Limited in the UK is a cleantech company based in Edinburgh that produces functional bio-additives from organic waste such as secondary biomass and difficult-to-recycle paper waste. Their flagship product, CreChar®, enhances anaerobic digestion, wastewater treatment, and can also be used for soil improvement. The company aims to boost green energy production, reduce greenhouse gas emissions, and optimize agricultural yields.",[0] Home - Carbogenics (https://www.carbogenics.com/) [1] Our Story - Carbogenics (https://www.carbogenics.com/our-story/) [2] About Us - Carbogenics (https://www.carbogenics.com/about-us/) [3] Carbogenics secures £1 million to build new facility (https://www.insider.co.uk/news/carbogenics-secures-1-million-build-30163021) [4] carbogenics | LinkedIn (https://www.linkedin.com/company/carbogenics-ltd),cleantech company,waste management and renewable energy,production of bio-additives from organic waste
