,person,role,organisation,company_summary,source_text,organisation_type,industry_domain,functional_expertise
82,Gideon Farrell,Co-founder & CTO,Converge,"Converge in the UK focuses on creating a converged, smart network that seamlessly connects customers to fixed and mobile networks, surpassing 4G, 5G, Wi-Fi, and ultrafast broadband services. This initiative aims to keep customers connected to what matters most to them across various locations.","[0] ConvergeOne Rebrands As C1: 'It's Sharper, Cleaner, Has More ... - CRN (https://www.crn.com/news/managed-services/convergeone-rebrands-as-c1-it-s-sharper-cleaner-has-more-of-a-punch-to-it) [1] The ancient network that links Britain - BBC (https://www.bbc.com/travel/article/20191104-the-ancient-network-that-links-britain) [2] Converged networks - Keeping the UK connection - Policy ... - BT (https://www.bt.com/about/bt/policy-and-regulation/keeping-the-uk-connected/converged-networks) [3] CONVERGE | English meaning - Cambridge Dictionary (https://dictionary.cambridge.org/dictionary/english/converge) [4] Are U.S. and UK Interest Rates About to Converge? - CME Group (https://www.cmegroup.com/education/featured-reports/are-us-and-uk-interest-rates-about-to-converge.html)",telecommunications initiative,network connectivity,converged networking technology
83,Glenn Morgan,Founding Partner,Clear Sky Fund,"Clear Sky Fund in the UK is a venture capital and growth equity fund manager that specializes in investing in innovative companies, particularly focusing on the cybersecurity and energy transition sectors. They fund cyber pioneers that enhance the safety of the connected world and invest in technology solutions that drive the energy transition and disruptive technologies in cybersecurity.",[0] ClearSky | Our Focus Areas (https://www.clear-sky.com/focus/) [1] ClearSky | About Us (https://www.clear-sky.com/about/) [2] ClearSky | What's next. (https://www.clear-sky.com/) [3] Clear Sky - Sustainable Aviation (https://www.clearsky.eco/) [4] Clear Sky Land Lease Communities Fund I Forms Dealer Syndicate and ... (https://finance.yahoo.com/news/clear-sky-land-lease-communities-113000701.html),venture capital and growth equity fund manager,cybersecurity and energy transition,investing in innovative technology solutions and disruptive technologies
84,Grant Aarons,Founder CEO,FabricNano,FabricNano in the UK develops biocatalysts designed to integrate with existing industry equipment to make a sustainable impact on the material world. They are focused on creating cell-free fossil fuel alternative technology to reduce the dependency on petroleum-based products and transition towards biological solutions. The company has raised significant funding to support their innovative approach in replacing petrochemical products with sustainable alternatives.,"[0] Our story - FabricNano (https://fabricnano.com/our-story) [1] Home - FabricNano (https://fabricnano.co.uk/) [2] FabricNano raises $12.5M to help scale its cell-free fossil fuel ... (https://techcrunch.com/2021/07/06/fabricnano-raises-12-5m-to-help-scale-its-cell-free-fossil-fuel-alternative-technology/) [3] London biotech FabricNano raises $12.5M, gets backing from ... - UKTN (https://www.uktech.news/news/london-biotech-fabricnano-raises-12-5m-20210630) [4] Meet FabricNano, a statup using enzymes to replace petrochemical products (https://www.uktech.news/deep-tech/fabricnano-enzymes-petrochemical-20231228)",startup,biotechnology,biocatalysts and cell-free fossil fuel alternative technology
85,Gregor Hoefter,Founder & CEO,GridDuck,"GridDuck in the UK provides an Internet of Things (IoT) Energy Management System (EMS) designed to connect appliances to the Internet and manage and monitor their energy usage in real-time. The system is tailored for retrofitting small and medium-sized sites, allowing for complete monitoring and control of appliances across multiple locations.",[0] About GridDuck: How We Can Help You to Save Energy and Cut Carbon ... (https://www.gridduck.com/about) [1] GridDuck - The Intelligent Energy Saving System for Commercial Buildings (https://www.gridduck.com/) [2] GridDuck and the Smart Grid - Medium (https://medium.com/gridduck/gridduck-and-the-smart-grid-be1bb831abab) [3] An Introduction to GridDuck (https://www.gridduck.com/blog/an-introduction-to-gridduck) [4] GridDuck | LinkedIn (https://www.linkedin.com/company/gridduck),technology company,energy management,Internet of Things (IoT) for real-time energy monitoring and control
86,Golsanam Paunovic,CEO,WORLD HTC LTD,"WORLD HTC LTD in the UK is a company that engages in leading innovation in smart mobile device and experience design, with a vision to put a personal computer in the palm of customers' hands. The company is focused on the evolution from palm PC to smartphone, embodying a pursuit of brilliance in its operations.","[0] WORLD HTC LTD overview - Find and update company information - GOV.UK (https://find-and-update.company-information.service.gov.uk/company/15497424) [1] Company Overview | About | HTC United Kingdom (https://www.htc.com/uk/about/) [2] HTC phones have disappeared from sale in the UK | Trusted Reviews (https://www.trustedreviews.com/news/htc-phone-uk-sales-3927956) [3] The long, slow, and painful death of HTC's smartphone business (https://www.wired.com/story/htc-phones/) [4] How conspiracy theories swirled after Donald Trump shooting - BBC (https://www.bbc.com/news/articles/cyr7pyd0687o)",technology company,smart mobile devices,experience design and innovation in mobile technology
87,Hamish McMichael,CEO & Founder,Ambue,"Ambue in the UK provides information and advice to help people use energy more efficiently in their homes. The company creates a Digital Twin of each home to analyze energy use and generate technical documents for contractors. Ambue was founded in 2020 and is based in Oxfordshire, United Kingdom.","[0] Facts and Statistics - Refuge (https://refuge.org.uk/what-is-domestic-abuse/the-facts/) [1] Make your housing energy efficient | Ambue (https://legacy.ambue.com/) [2] Domestic Abuse Act: Factsheet - Home Office in the media (https://homeofficemedia.blog.gov.uk/2021/04/29/domesticabuseactfactsheet/) [3] Ambue | LinkedIn (https://www.linkedin.com/company/ambue) [4] Ambue - Products, Competitors, Financials, Employees, Headquarters ... (https://www.cbinsights.com/company/ambue)",company,energy efficiency,digital twin technology for energy analysis
88,Harry Davies,Chief of Staff,Greyparrot,"Greyparrot in the UK specializes in waste intelligence solutions using AI technology. They track billions of waste objects annually, providing real-time insights to waste managers for operational improvements. Greyparrot collaborates with partners in the waste industry to scale digitization, automate processes, and enhance material recovery and quality output. Their vision includes utilizing waste intelligence to support better recycling practices and packaging design.",[0] Why we're on a mission to increase resource recovery | Greyparrot AI (https://www.greyparrot.ai/about-us) [1] Unlock the power of AI waste analytics | Greyparrot waste intelligence (https://www.greyparrot.ai/) [2] The AI trained to recognise waste for recycling - BBC News (https://www.bbc.co.uk/news/business-66042169) [3] UK AI startup Greyparrot bags strategic tie-up with recycling giant ... (https://techcrunch.com/2024/02/07/greyparrot-bollegraaf/) [4] Grey parrot - Wikipedia (https://en.wikipedia.org/wiki/Grey_parrot),startup,waste management and recycling,artificial intelligence and waste analytics
89,Harry Grocott,Co-Founder & CEO,Treeconomy,"Treeconomy in the UK provides vital satellite data to Project Developers, offers frequent monitoring of projects and portfolios over time, and is relied upon by leading corporate buyers, partners, and climate pioneers. The company's mission includes accelerating the regeneration of the natural world, combating climate change, supporting biodiversity, and improving livelihoods. Treeconomy aims to remove 1Gt of CO2 from the atmosphere through nature restoration scaling by 2024.",[0] Treeconomy | Unlock Nature's Value (https://www.treeconomy.co/) [1] Treeconomy | Unlock Nature's Value (https://www.treeconomy.co/about) [2] Treeconomy | Unlock Nature's Value (https://www.treeconomy.co/blog/3-questions-to-shape-treeconomys-2024) [3] Understanding the UK economy - Office for National Statistics (https://www.ons.gov.uk/economy/nationalaccounts/articles/dashboardunderstandingtheukeconomy/2017-02-22) [4] What is a recession and how could one affect me? - BBC News (https://www.bbc.co.uk/news/business-52986863),startup,climate technology,satellite data analytics and nature restoration
90,Harry Owen-Jones,Co-founder & COO,3Space,"3Space in the UK is a company that specializes in transforming vacant commercial premises into affordable workspaces. They work with government, developers, and corporates to repurpose empty buildings, with a focus on creating better use of commercial space across the UK.",[0] 3Space | LinkedIn (https://www.linkedin.com/company/3space) [1] We are 3-Space (UK) Ltd (https://www.3-spaceuk.com/) [2] 3-Space (UK) Ltd | LinkedIn (https://www.linkedin.com/company/3-space-uk-ltd) [3] About — 3Space (http://www.3space.org/about) [4] About Us — International House Brixton (https://www.3spaceinternational.co.uk/about-us),company,commercial real estate,repurposing vacant commercial premises into affordable workspaces
91,Harry Wright,Founder & CEO,Bright Tide,"Bright Tide in the UK works with businesses to address urgent climate and biodiversity challenges around the world. They aim to Educate, Engage, and Empower organizations to better understand the risks and emerging opportunities related to climate change, biodiversity loss, and natural capital.","[0] How Tides Work, all you need to know about UK Tides & Waves - Coast Radar (https://coastradar.com/how-tides-work/) [1] Bright tide launches UK's most specialist Blue Economy ocean ... (https://www.oceanbusiness.com/general-ocean-news/bright-tide-launches-uks-most-specialist-blue-economy-ocean-accelerator/) [2] About tides - Tides: questions and answers | National Tidal and Sea ... (https://ntslf.org/about-tides/tides-faq) [3] All about tides | National Tidal and Sea Level Facility - NTSLF (https://ntslf.org/about-tides/tides) [4] Biodiversity | Bright Tide (https://www.bright-tide.co.uk/)",consultancy,climate change and biodiversity,risk assessment and opportunity identification related to climate change and natural capital
92,Dr. Henrietta Boyd,Co-Founder & Director,Halocycle,"Halocycle in the UK is dedicated to turning waste plastic, particularly chlorine-containing plastic (PVC), back into oil and gas using microwave processing technology. Their mission is to provide a solution to the plastics problem by creating a circular lifecycle for plastic, aiming to reduce plastic waste entering landfills and the environment. They have developed an IP-protected innovation for the advanced recycling of PVC, with the goal of reusing the hydrocarbon product in new plastics.",[0] About Halocycle | Turning waste plastic back into oil and gas (https://www.halocycle.co.uk/about) [1] Solution To The Plastics Problem | Halocycle | England (https://www.halocycle.co.uk/) [2] Plastic Recycling | Halocycle - A solution to the plastics problem (https://www.halocycle.co.uk/plastic-recycling) [3] Green Angel Ventures completes investment enabling PVC breakthrough (https://greenangelventures.com/news/green-angel-ventures-completes-investment-enabling-pvc-breakthrough/) [4] Halocycle | LinkedIn (https://www.linkedin.com/company/halocycle/),startup,plastic recycling,microwave processing technology for advanced recycling of PVC
93,Henrietta Moon,Co-Founder & CEO,Carbo Culture,"Carbo Culture in the UK is a project developer with proprietary climate technology focused on carbon removal. The company aims to remove 1 billion tons of carbon dioxide from the atmosphere by converting plant matter into a stable form of pure carbon. They have opened one of Europe's largest biochar plants near Helsinki, capable of removing 3,000 tonnes of carbon dioxide annually. Carbo Culture also produces renewable energy as a by-product of their carbon removal process. They are in the process of building a scaled-up facility to become one of Europe's largest carbon removal facilities.",[0] About - Carbo Culture (https://carboculture.com/about) [1] Home - Carbo Culture (https://carboculture.com/) [2] Finnish startup Carbo Culture opens one of Europe's largest carbon ... (https://sifted.eu/articles/carbo-culture-biochar-plant-news) [3] Carbo Culture: defining the future of biochar carbon removal (https://www.climate-race.com/stories-2/carbo-culture-establishing-the-future-of-biochar-carbon-removal-7kzts) [4] Large-scale CO2 removal startup Carbo Culture raises $6.2M Seed led by ... (https://techcrunch.com/2021/04/14/large-scale-co2-removal-startup-carbo-culture-raises-6-2m-seed-led-by-true-ventures/),project developer,carbon removal,proprietary climate technology focused on converting plant matter into stable carbon
94,Henrik Hagemann​​​​,CEO,Purafinnity,"Puraffinity in the UK specializes in designing and manufacturing novel advanced materials for environmental benefit, focusing on removing harmful pollutants from water and wastewater. They have a strong emphasis on sustainability, environmental stewardship, and fulfilling social responsibilities. Additionally, the company has received funding and grants for their work in developing technology for the removal of PFAS 'forever chemicals' across water treatment applications.","[0] About Puraffinity | Smart Materials Company (https://www.puraffinity.com/about) [1] Home | Puraffinity: Smart Materials Company (https://www.puraffinity.com/) [2] Puraffinity | LinkedIn (https://uk.linkedin.com/company/puraffinity) [3] Puraffinity, the PFAS removal specialist, raises $13.9m in Series A ... (https://www.watermagazine.co.uk/2023/09/25/puraffinity-the-pfas-removal-specialist-raises-13-9m-in-series-a-funding-led-by-octopus-ventures/) [4] Puraffinity Receives Innovate UK Grant for PFAS Treatment (https://www.businesswire.com/news/home/20220421005287/en/Puraffinity-Receives-Innovate-UK-Grant-for-PFAS-Treatment)",startup,environmental technology,advanced materials for pollutant removal from water and wastewater
95,Hugo Spowers MBE,Company Architect and MD,Riversimple Movement Ltd,"Riversimple Movement Ltd, formerly known as Riversimple Engineering Ltd, is a UK-based car manufacturer that focuses on producing hydrogen-powered fuel cell electric vehicles (FCEVs). The company is dedicated to developing sustainable transportation solutions to reduce the environmental impact of personal transport. Their first vehicle, the Rasa, is an electric car powered by hydrogen, and they emphasize emission-free driving with the ability to refill in just three minutes.",[0] Riversimple Movement (https://www.riversimple.com/riversimple-movement/) [1] Riversimple Movement - an Unreasonable company (https://unreasonablegroup.com/ventures/riversimple-movement) [2] Riversimple - Wikipedia (https://en.wikipedia.org/wiki/Riversimple) [3] Riversimple (http://www.riversimple.com/) [4] Riversimple Movement Ltd - Member of the World Alliance - Solar Impulse (https://solarimpulse.com/companies/riversimple-movement-ltd),car manufacturer,sustainable transportation,hydrogen-powered fuel cell electric vehicles (FCEVs)
96,Illai Gescheit,Founder,Unbreakable Ventures; Mindset & Planet,"Unbreakable Ventures; Mindset & Planet in the UK are likely to be involved in the venture capital ecosystem in the UK. UK startups have been securing significant venture capital funding, with the region maintaining its position as Europe's leading venture ecosystem. The UK has demonstrated solid growth in venture capital investments despite economic uncertainty and the effects of Brexit. The venture capitalists' unique approach to investment and innovation has played a pivotal role in the UK's tech ecosystem.","[0] Unlocking the Potential: Why Investing in the UK's Venture Capital ... (https://medium.com/@QVentures_/unlocking-the-potential-why-investing-in-the-uks-venture-capital-ecosystem-makes-sense-925f30f8b867) [1] 40 years of VC: Where does Europe's biggest VC hub stand today? (https://sifted.eu/articles/uk-vc-2023-brnd) [2] Make Decisions with a VC Mindset - Harvard Business Review (https://hbr.org/2024/05/make-decisions-with-vc-mindset) [3] Mapping the UK, Ireland VC ecosystem - PitchBook (https://pitchbook.com/news/articles/uk-ireland-venture-capital-startup-ecosystem) [4] Explore a report looking at the outlook for UK innovation in 2024 | HSBC UK (https://www.business.hsbc.uk/en-gb/corporate/insights/support/explore-a-report-looking-at-the-outlook-for-uk-innovation-in-2024)",venture capital,technology and innovation,investment strategies and startup funding
97,Dr. Imke Sittel,CSO,Glaia Ltd.,"Glaia Ltd. in the UK is an agri-tech company that provides nanotechnology-based solutions for agriculture. They have developed products that enhance plant photosynthesis, resulting in increased biomass and yield for crops. Founded in 2019 by two former University of Bristol scientists, Dr. David Benito and Dr. Imke Sittel, Glaia's technology aims to supercharge crop growth without increasing greenhouse gases.",[0] Glaia (https://www.glaia.co.uk/) [1] About — Glaia (https://www.glaia.co.uk/about) [2] How it works — Glaia (https://www.glaia.co.uk/how-it-works) [3] Agri-tech start-up Glaia lands £1 million investment from Green Angel ... (https://thebusinessmagazine.co.uk/technology-innovation/agri-tech-start-up-glaia-lands-1-million-investment-from-green-angel-syndicate/) [4] Glaia Ltd - Agri-TechE (https://www.agri-tech-e.co.uk/civi_member/glaia-ltd/),agri-tech company,agriculture,nanotechnology-based solutions for enhancing plant photosynthesis
98,Insiya Jafferjee,CEO & Co-Founder,Shellworks,"Shellworks in the UK collaborates with nature to create innovative, compostable packaging solutions. Their bio-based material called Vivomer is a home compostable alternative to single-use plastic, which is vegan, petroleum-free, and made with the help of friendly microbes. The company aims to reduce plastic waste by offering sustainable packaging options and has recently raised $6.2 million in seed funding to scale its plastic-free and compostable packaging technology. They are focusing on targeting the beauty industry initially to commercialize their compostable vegan packaging business.",[0] Shellworks - Packaging Made and Unmade by Microbes : Shellworks (https://shellworks.com/) [1] This Plastic Packaging Alternative Can Compost in a Year (https://www.wired.com/story/wired-impact-shellworks-biodegradable-plastic/) [2] About Us : Shellworks (https://shellworks.com/about-us/) [3] Shellworks raises £5m for compostable plastic-free packaging (https://www.uktech.news/deep-tech/shellworks-compostable-plastic-20220525) [4] Shellworks raises $6.2 million to reimagine the cosmetics packaging ... (https://manufacturingvoices.co.uk/2022/05/shellworks-raises-6-2-million-to-reimagine-the-cosmetics-packaging-industry-and-scale-its-plastic-free-compostable-solutions/),startup,sustainable packaging,biodegradable materials and compostable packaging technology
99,Irina Gorbounova,Head of XCarb Innovation Fund,ArcelorMittal,ArcelorMittal in the UK is involved in steel production and research & development. The company produces around 90 million tons of steel annually and has a focus on developing technologies to reduce the carbon footprint of steel.,[0] ArcelorMittal - Wikipedia (https://en.wikipedia.org/wiki/ArcelorMittal) [1] ArcelorMittal warns that one of its main divisions could quit UK (https://www.ft.com/content/bf8f928a-149b-4b62-ab84-5ff66a42a061) [2] About | ArcelorMittal (https://corporate.arcelormittal.com/about) [3] PDF ArcelorMittal Europe Fact book 2023 (https://europe.arcelormittal.com/repository2/Europe/ArcelorMittal_Europe_Factbook_2023.pdf) [4] ArcelorMittal warns one of its main divisions could quit Britain (https://www.thenationalnews.com/business/2024/05/06/arcelormittal-warns-one-of-its-main-divisions-could-quit-britain/),corporation,steel production,research and development in carbon reduction technologies
100,Jamie Burrows,Founder & CEO,Vertical Future,"Vertical Future in the UK is a global Controlled-Environment-Agriculture (""CEA"") technology and data company that designs, manufactures, and builds autonomous vertical farms, encompassing proprietary hardware and software. Their solutions focus on food and water security in the context of food for human consumption, utilizing techniques such as soil-free growing and LED lights for plant growth.","[0] Vertical Future | Advanced Vertical Farming Solutions Company (https://verticalfuture.com/) [1] Vertical farming on the rise in the UK - FarmingUK News (https://www.farminguk.com/news/vertical-farming-on-the-rise-in-the-uk_58813.html) [2] What does the future hold for vertical farming in the UK? (https://www.verticalfarmdaily.com/article/9585228/what-does-the-future-hold-for-vertical-farming-in-the-uk/) [3] Meet Jamie Burrows, Founder and CEO of Vertical Future in his 'Just ... (https://verticalfuture.com/meet-jamie-burrows-founder-and-ceo-of-vertical-future-in-his-just-entrepreneurs-interview/) [4] Gloucestershire vertical farm is one of UK's 'most advanced' - BBC (https://www.bbc.co.uk/news/uk-england-gloucestershire-68341208)",technology and data company,Controlled-Environment Agriculture (CEA),"designing, manufacturing, and building autonomous vertical farms with proprietary hardware and software"
101,Jamie Crummie,Co-founder,Too Good To Go,"Too Good To Go in the UK is a social impact company that operates the world's largest marketplace for surplus food. Through their app, they help users rescue good food from going to waste by offering great value for money at local stores, cafes, and restaurants. Users can easily see which establishments in their local area have leftover food available for purchase at a discounted price.",[0] Too Good To Go | Save Good Food From Going To Waste (https://www.toogoodtogo.com/en-gb) [1] Too Good To Go Marketplace App | How It Works (https://www.toogoodtogo.com/en-gb/how-does-the-app-work) [2] Too Good To App review - what I saved and ate (https://www.goodhousekeeping.com/uk/consumer-advice/a60380448/too-good-to-go-reviewed/) [3] How do I use Too Good To Go? - Too Good To Go (https://www.toogoodtogo.com/en-gb/blog/how-do-use-too-good-to-go) [4] TooGoodToGo App Review - everything you need to know - Katykicker (https://katykicker.com/too-good-to-go-review-uk-app/),social impact company,food waste management,mobile app marketplace for surplus food
102,Jamie Rowles,Partner,Planet Fund,"The Blue Planet Fund in the UK supports developing countries in protecting the marine environment, reducing poverty, tackling climate change, and preserving biodiversity. It focuses on ODA-eligible coastal countries in priority regions such as South and Southeast Asia. Additionally, the fund aims to help achieve the global '30by30' target, which seeks to protect at least 30% of the land and ocean by 2030.",[0] Blue Planet Fund - GOV.UK (https://www.gov.uk/government/publications/blue-planet-fund/blue-planet-fund) [1] What is the UK Government's Blue Planet Fund? (https://www.deliveringforscotland.gov.uk/case-studies/blue-planet-fund/) [2] Blue Planet Fund delivers first multimillion boost for global ocean ... (https://deframedia.blog.gov.uk/2021/08/13/blue-planet-fund-delivers-first-multimillion-boost-for-global-ocean-recovery/) [3] Blue Planet Fund - GOV.UK (https://www.gov.uk/government/publications/blue-planet-fund) [4] Blue Planet Fund - ICAI (https://icai.independent.gov.uk/review/blue-planet-fund/),government fund,marine conservation and climate action,"environmental protection, poverty reduction, biodiversity preservation"
103,Jan Ahrens,CEO,SparkChange,"SparkChange in the UK is involved in carbon markets, specifically focusing on carbon price risk and offering investment opportunities in physical EU carbon allowances (EUAs) through the launch of the world's first exchange-traded product (ETP) called SparkChange Physical Carbon EUA ETC (Ticker: CO2) on the London Stock Exchange.",[0] SparkChange - Helping Investors Adapt To The Climate Crisis (https://sparkchange.io/#GatingModalLocation) [1] London Stock Exchange | London Stock Exchange (https://www.londonstockexchange.com/discover/news-and-insights/london-stock-exchange-welcomes-sparkchange-and-hanetf-celebrating-launch-worlds-first-exchange-traded-product-etp-backed-physical-eu-carbon-allowances-euas) [2] SparkChange CO2 - SparkChange (https://sparkchange.io/products/co2-l/#GatingModalLocation) [3] About SparkChange - SparkChange (https://sparkchange.io/company/about-sparkchange/#GatingModalLocation) [4] Physical carbon credit ETF wins praise despite some misgivings (https://www.ft.com/content/8fdc485a-b9d6-4749-a7d5-3249f1ab4475),financial services,carbon markets,investment opportunities in physical EU carbon allowances
