,person,role,organisation,company_summary,source_text,organisation_type,industry_domain,functional_expertise
145,Murray Collins PhD,Co-Founder & CEO,Space Intelligence Ltd,"Space Intelligence Ltd in the UK specializes in providing nature data and digital monitoring systems to reduce risk and enhance the integrity of financial mechanisms aimed at expanding funding for forest conservation and restoration. They have been awarded contracts by the UK Space Agency for feasibility studies supporting the use of satellite data by financial institutions for nature investment. The company is also involved in environmental consulting activities, technical testing and analysis, as well as research and experimental development on natural sciences and engineering.",[0] About Us - Space Intelligence (https://www.space-intelligence.com/about-us/) [1] Home - Space Intelligence (https://www.space-intelligence.com/) [2] Space Intelligence | LinkedIn (https://uk.linkedin.com/company/space-intelligence) [3] Careers at Space Intelligence - Space Intelligence (https://www.space-intelligence.com/careers/) [4] SPACE INTELLIGENCE LTD - Find and update company information - GOV.UK (https://find-and-update.company-information.service.gov.uk/company/SC595836),company,environmental consulting and nature data services,satellite data analysis and digital monitoring systems for financial mechanisms in forest conservation
146,Murvah Iqbal,Co-CEO,HIVED,"HIVED in the UK is a sustainable parcel delivery network that operates a 100% electric fleet for deliveries. They aim to decarbonize the industry and offer green solutions for all aspects of the parcel journey. The company was founded with a vision of creating the most sustainable, people-centric, efficient, and affordable delivery network ever. They have received a £10 million Series A funding round to support their goal of becoming the number one sustainable delivery company in the UK and a major player in key European markets within five years. Some of their shipping clients include ASOS, Zara, Pip & Nut, and Minor Figures.","[0] Learn about HIVED - a delivery company making a difference (https://www.hived.space/about) [1] HIVED | Sustainable parcel delivery (https://www.hived.space/) [2] Hived is bringing a 'green' buzz to parcel delivery in the UK as it ... (https://tech.eu/2023/04/27/hived-is-bringing-a-green-buzz-to-parcel-delivery-in-the-uk-as-it-raises-10-million/) [3] Introducing HIVED - Parcel Delivery Reinvented (https://www.hived.space/blog/an-introduction-to-hived-parcel-delivery-reinvented) [4] HIVED, a London-based company building zero-emissions parcel delivery ... (https://www.uktech.news/news/hived-a-london-based-company-building-zero-emissions-parcel-delivery-network-secures-1-74m-funding-20210921)",sustainable delivery network,parcel delivery,electric fleet operations and decarbonization solutions
147,Namratha Kothapalli,Principal,Speedinvest,"Speedinvest in the UK partners with visionary early-stage European tech startups, providing them with value-adding support for business development and expansion. They have a team on the ground in the UK, along with other key European countries, to assist startups in scaling their growth-stage companies globally. Speedinvest is known for being one of the most active early-stage investors in Europe with over €1 billion in assets under management.","[0] UK Tech Startups | A Look at Speedinvest's Portfolio in the UK (https://www.speedinvest.com/blog/united-kingdom-tech-startups) [1] Game-Changing Startup Founder Support - Speedinvest (https://www.speedinvest.com/about) [2] Funding Early-Stage European Tech Startups - Speedinvest (https://www.speedinvest.com/) [3] Why Speedinvest: Interviews, Careers, & Portfolio (https://growthequityinterviewguide.com/speedinvest) [4] Speedinvest | LinkedIn (https://www.linkedin.com/company/speedinvest)",venture capital,technology startups,business development and expansion support for early-stage companies
148,Natalia Dorfman,Co-founder & CEO,Kita,"Kita in the UK offers insurance products tailored for a decarbonized world, focusing on carbon sequestration solutions. They provide coverage for companies based in the UK among other countries, helping to de-risk carbon credit transactions and encourage investment in high-quality carbon projects. Kita has been approved as a Lloyd's of London coverholder, marking a significant milestone for the company.",[0] Carbon Insurer Kita Readies for Launch in London | eWeek UK (https://www.eweekuk.com/startups/carbon-insurer-kita-readies-for-launch-in-london/) [1] Kita (https://www.kita.earth/) [2] Kita | LinkedIn (https://uk.linkedin.com/company/kitaearth) [3] FAQs — Kita (https://www.kita.earth/faqs) [4] Kita is a Lloyd's of London Coverholder — Kita (https://www.kita.earth/blog/kita-coverholder-lloyds),insurance company,carbon sequestration and carbon credit transactions,insurance products tailored for decarbonization and investment in carbon projects
149,Neil Morris,Founder & CEO,Kelpi,"Kelpies in the UK, specifically in Scottish and Irish folklore, are shape-shifting spirits that inhabit lochs. They are often described as grey or white horse-like creatures capable of adopting human form. Kelpies are known to warn of approaching storms, but they also possess the ability to drown individuals or take them as mates. The folklore surrounding kelpies serves as a cautionary tale, warning people to be wary of dangerous waters and attractive strangers.","[0] The Kelpie, Mythical Scottish Water Horse - Historic UK (https://www.historic-uk.com/CultureUK/The-Kelpie/) [1] Kelpie - Wikipedia (https://en.wikipedia.org/wiki/Kelpie) [2] 15 Facts About The Kelpie, Water Horses Who Can Shape-Shift Into Human ... (https://thoughtcatalog.com/january-nelson/2018/08/the-kelpie/) [3] The Kelpies in Scotland - A Short & Quick Guide (https://highlands2hammocks.co.uk/kelpies-in-scotland/) [4] The Kelpie - Mythological Water Horse of Scotland (https://www.horsejournals.com/popular/history-heritage/kelpie-mythological-water-horse-scotland)",cultural folklore,mythology and storytelling,folklore studies and cultural heritage
150,Neil Spann,CEO,Power Roll,"Based on the provided data, Power Roll in the UK operates a pilot factory with a capacity of 30 MW that utilizes low-cost roll-to-roll manufacturing processes and patented microgroove technology for flexible solar modules.",[0] What Does the British Monarchy Actually Do? | TIME (https://time.com/6213624/what-does-british-monarchy-do/) [1] The role of the Monarchy | The Royal Family (https://www.royal.uk/the-role-of-the-monarchy) [2] What Is the Monarch's Role in British Government? | HISTORY (https://www.history.com/news/what-is-the-queens-role-in-british-government) [3] What is the role of the monarchy? | The Constitution Unit - UCL ... (https://www.ucl.ac.uk/constitution-unit/explainers/what-role-monarchy) [4] New flexible solar module factory begins operations in the UK (https://www.pv-magazine.com/2022/02/25/new-flexible-solar-module-factory-begins-operations-in-the-uk/),startup,renewable energy,solar technology and manufacturing processes
151,Nick Wood,COO,Adamo Foods,"Adamo Foods in the UK is a food technology company focused on developing innovative alternatives to meat whole cuts. They are known for launching sustainable and delicious steak products made entirely from fungi. The company aims to revolutionize the food system by providing ultra-realistic and environmentally-conscious alternatives to traditional meat products. As of June 2022, Adamo Foods had secured £1.5 million in funding to further develop and bring their meat alternative products to market.",[0] Our mission — Adamo Foods (https://www.adamofoods.com/ourmission) [1] Adamo Foods (https://www.adamofoods.com/) [2] Adamo Foods secures £1.5m funding to bring meat alternative steak to ... (https://www.thegrocer.co.uk/fundraising/adamo-foods-secures-15m-funding-to-bring-meat-alternative-steak-to-market/680439.article) [3] Adamo Foods develops Europe's first 'ultra-realistic' steak alternative (https://www.foodnavigator.com/Article/2022/09/28/adamo-foods-develops-europe-s-first-ultra-realistic-steak-alternative) [4] Adamo Foods bites into $620k to launch Europe's first ultra-realistic ... (https://www.adamofoods.com/blog/adamo-foods-bites-into-620k),food technology company,meat alternatives,development of innovative alternatives to meat using fungi
152,Oliver Baker,CEO,Ambion Heating,Ambion Heating in the UK specializes in providing low-carbon heating solutions for homes and businesses. They offer innovative technologies such as infrared heat panels to help reduce carbon emissions and meet decarbonization goals. Ambion Heating is committed to helping the UK transition towards more sustainable heating options as the country moves towards its net zero emissions target.,"[0] At Ambion, we're on a mission to heat homes better (https://ambionheating.com/about/) [1] Heating homes and buildings cheaper, greener and healthier - Ambion (https://ambionheating.com/) [2] Life at Ambion Heating - Ambion (https://ambionheating.com/life-at-ambion-heating/) [3] PDF introducing Ambion (https://easyfairsassets.com/sites/242/2024/01/AMB1875-Ambion-Smaller-Homes-Brochure-v5-DIGITAL-2-7.pdf) [4] PDF introducing Ambion - wates.co.uk (https://www.wates.co.uk/wp-content/uploads/2023/01/Ambion-Homes-and-Developments-Brochure-2022.pdf)",company,low-carbon heating solutions,innovative heating technologies such as infrared heat panels
153,Oliver Bolton,Co-Founder & CEO,Earthly,"Earthly in the UK helps companies invest in nature through high-quality nature-based solutions that remove carbon, restore biodiversity, and improve livelihoods. They empower organizations globally to address climate breakdown and biodiversity collapse by identifying impactful nature-based projects aligned with clients' environmental and social goals. Earthly is a registered company in London, UK, with a remote team based around the world.",[0] Earthly | Invest in nature (https://earthly.org/) [1] We Are Earthly | Become Climate Positive (https://earthly.org/about-us) [2] FAQs | Earthly | Become Climate Positive (https://earthly.org/faqs) [3] Earth's core has slowed so much it's moving backward ... - CNN (https://www.cnn.com/2024/07/05/science/earth-inner-core-rotation-slowdown-cycle-scn/index.html) [4] Six things the UK could do to tackle climate change - BBC News (https://www.bbc.co.uk/news/business-58885545),company,nature-based solutions,"carbon removal, biodiversity restoration, and livelihood improvement"
154,Orla Shields,CEO & Co-Founder,Kamma,"Kamma in the UK is primarily associated with Buddhist teachings on karma and rebirth. The concept of Kamma, or Karma, is understood as the law of cause and effect, where intentional actions - whether mental, verbal, or physical - have the potential to produce their due effects without external intervention. This belief in karma and reincarnation is a fundamental aspect of Buddhist doctrine and is detailed in ancient Buddhist texts.","[0] Kamma (caste) - Wikipedia (https://en.wikipedia.org/wiki/Kamma_(caste)) [1] Questions and Answers on Kamma (karma) and Re-birth (https://londonbuddhistvihara.org/teachings/kamma-and-re-birth/) [2] Kamma and Rebirth | The London Buddhist Vihara (https://www.londonbuddhistvihara.org/teachings/kamma-and-rebirth/) [3] The Law of Kamma, Natural Laws and the Process of Cognition (https://londonbuddhistvihara.org/teachings/the-law-of-kamma-natural-laws-and-the-process-of-cognition/) [4] Kamma: A Study Guide - Access to Insight (https://www.accesstoinsight.org/lib/study/kamma.html)",Buddhist teaching organization,Spiritual education,Teachings on karma and rebirth
155,Paddy Lowe,Founder & CEO,Zero Petroleum Limited,"Zero Petroleum Limited in the UK is a company that specializes in the production of non-biological carbon-neutral e-fuel as an alternative to fossil-based fuels. The company was co-founded by former Formula One engineer Paddy Lowe and aims to provide a sustainable and scalable alternative to traditional fuels. Zero Petroleum recently announced the opening of its first synthetic fuel facility, Plant Zero.1, which is set to lead the way in providing synthetic fuels at a global scale.",[0] Carbon Neutral Synthetic Fuels | Our Vision | Zero (https://www.zero.co/) [1] Zero (corporation) - Wikipedia (https://en.wikipedia.org/wiki/Zero_(corporation)) [2] About Zero | Zero (https://www.zero.co/about) [3] Zero Petroleum to open world's first fully synthetic fuel facility (https://www.chemengonline.com/zero-petroleum-to-open-worlds-first-fully-synthetic-fuel-facility/) [4] Zero Petroleum signs game-changing fossil-free synthetic fuel ... (https://thebusinessmagazine.co.uk/technology-innovation/zero-petroleum-signs-game-changing-fossil-free-synthetic-fuel-development-contract-with-raf/),company,sustainable fuels,production of non-biological carbon-neutral e-fuels
156,Panos Stravopodis,Co-founder & CTO,Elyos Energy,"Elyos Energy in the UK focuses on enabling commercial buildings to play a major role in the decarbonisation effort by providing energy flexibility solutions at scale. They aim to address the supply and demand challenges in the energy sector, particularly targeting the 1.6 million commercial buildings in the UK with a combined energy use of 141TwH, which accounts for about a third of the UK's total annual electricity consumption.",[0] Elyos Energy | About (https://www.elyosenergy.com/about) [1] Elyos Energy: The platform for energy flexibility and demand response ... (https://www.ycombinator.com/companies/elyos-energy) [2] Electrification and the UK's commitment to Net Zero (https://www.elyosenergy.com/blog/electrification-in-the-uk) [3] Elyos Energy | Energy flexibility and demand response (https://www.elyosenergy.com/) [4] YC-backed energy startup Elyos raises £2.5m - uktech.news (https://www.uktech.news/climate-tech/yc-backed-energy-startup-elyos-raises-2-5m-20231013),startup,energy flexibility and decarbonisation,energy management solutions for commercial buildings
157,Patrick Baptista Pinto,Co-Founder,Really Clever,"Really Clever in the UK is a fungal discovery platform that assesses the characteristics of fungal organisms and matches them to sustainable products. They focus on the potential of fungal species, estimated to be between 2.1 million and 3.1 million, for creating innovative and sustainable solutions.","[0] 88 very British phrases that will confuse anybody who didn't grow up in ... (https://www.independent.co.uk/life-style/british-phrases-english-language-sayings-britain-england-uk-different-a8138046.html) [1] 35+ British Sayings and Idioms - Learn to Speak like a Brit - Preply (https://preply.com/en/blog/british-sayings/) [2] 11 British Stereotypes and the Honest Truth - girl gone london (https://girlgonelondon.com/british-stereotypes/) [3] Meet Really Clever, the company making leather from fungi (https://www.maddyness.com/uk/2022/07/21/meet-really-clever-the-company-making-leather-from-funghi/) [4] 50 things we love about the UK (and know you'll love too) (https://www.ef.com/wwen/blog/language/things-we-love-about-the-uk/)",fungal discovery platform,sustainable products,assessment of fungal organisms and their characteristics
158,Patrick Dumas,Founder & CEO,Square Mile Farms,"Square Mile Farms in the UK integrates vertical farms into office spaces to create beautiful spaces that provide city dwellers with physical and mental wellbeing benefits of plants. They aim to promote a more sustainable agricultural system and offer unique engagement experiences through events and farm installations. Founded in 2018, the company has established over 60 urban farm installations in 27 locations, demonstrating a growing demand for urban farming.",[0] About | London | Square Mile Farms (https://www.squaremilefarms.com/about) [1] Square Mile Farms | England (https://www.squaremilefarms.com/) [2] Our Why | London | Square Mile Farms (https://www.squaremilefarms.com/why) [3] Square Mile Farms now has more than 60 farms in over 25 locations ... (https://homedesignerandarchitect.co.uk/2022/03/09/square-mile-farms-now-has-more-than-60-farms-in-over-25-locations-demonstrating-the-growing-demand-for-urban-farming-sm_farms/) [4] Square Mile Farms now has more than 60 urban farms in over 25 ... - FMJ (https://www.fmj.co.uk/square-mile-farms-now-has-more-than-60-urban-farms-in-over-25-locations/),startup,urban agriculture,vertical farming and sustainable agriculture solutions
159,Patrick Geraets,CEO,SenseWind,"SENSEWind in the UK specializes in providing a self-installation system for wind turbines, enabling rapid turbine installation and major maintenance on tall onshore towers and deep-water offshore sites. The company has received a £10 million grant from the UK government for an upcoming floating offshore wind demonstration project in Scotland. The SENSEWind system aims to revolutionize the installation of wind turbines by eliminating the need for large expensive cranes and crane vessels, making the process more efficient and cost-effective.",[0] Press Release from SENSEWind - SENSEWind self-installation system gets ... (https://sensewind.com/press-release-from-sensewind-sensewind-self-installation-system-gets-major-funding-boost-from-uk-government/) [1] SENSEWind: Installing and servicing turbines higher… deeper… safer ... (https://sensewind.com/) [2] Press release: SENSEWind system proves its worth (https://sensewind.com/press-release-sensewind-system-proves-its-worth/) [3] SENSEWind Self-Installation System Gets Major Funding Boost from UK ... (https://dredgewire.com/sensewind-self-installation-system-gets-major-funding-boost-from-uk-government/) [4] UK Bankrolls Self-Installing Floating Offshore Wind Project (https://www.offshorewind.biz/2022/01/25/uk-bankrolls-self-installing-floating-offshore-wind-project/),startup,renewable energy,self-installation systems for wind turbines
160,Patrick Jackson,Founder,Picker Pals,"Picker Pals in the UK is an educational programme for 6-9 year olds focused on environmental stewardship, learning outcomes, and fun. It involves activities such as litter-picking adventures, learning about the environment, recycling, waste management, and providing unique upcycled Picker Packs to classrooms to empower children and their families to make a real impact in their local areas. The program is led by teachers, involves activated kids, is supported by parents, and admired by communities.",[0] UK - Picker Pals (https://pickerpalsworld.org/uk/) [1] How it works | Environmental learning activities | Picker Pals (https://pickerpalsworld.org/how-it-works/) [2] Picker Pals (https://pickerpalsworld.org/) [3] Picker Pals | VOICE Ireland (https://www.voiceireland.org/workshops/picker-pals) [4] Picker Pals Report 2020-21 School Year - Issuu (https://issuu.com/pickerpalsworld/docs/picker_pals_eoy_report_2020-21),educational programme,environmental education,"environmental stewardship, recycling, waste management, and community engagement activities for children"
161,Paul Cooke,Co-founder & CEO,Weekly.Shop,"Weekly.Shop in the UK offers insights into food shopping behavior and grocery market trends in the United Kingdom. According to data sources, the average weekly food expenditure for a family of four in the UK is around £86.30, with variations based on income levels. Additionally, the average grocery bill for one person in the UK is approximately £35 per week. Key trends in the UK grocery market include a focus on discount shopping and sustainability, with supermarkets like Waitrose, Marks & Spencer, and Whole Foods catering to organic and higher-end food options.","[0] How much the average UK family spends on their weekly food shop (https://skintdad.co.uk/average-weekly-food-shop/) [1] What Is The Average Weekly Food Bill In The UK (Individuals, Couples ... (https://moneysprout.co.uk/average-weekly-food-bill-in-the-uk/) [2] Grocery Stores US vs UK: 5 Important Differences You Need to Know (https://londoninreallife.com/living-in-london/grocery-stores-us-vs-uk/) [3] Average Grocery Bill in the UK: How Much Are You Spending? (https://www.projectfinanciallyfree.com/average-grocery-bill-in-the-uk/) [4] Food shopping behavior in the UK - statistics & facts | Statista (https://www.statista.com/topics/9073/food-shopping-behavior-in-the-uk/)",market research,grocery and food retail,consumer behavior analysis and market trend insights
162,Pete Sharman,Co-Founder,THIS,"The UK is a country that has historical significance as the first industrialized nation and a former global power. It is known for its influence in various aspects such as literature, language, music, and sports. The prime minister serves as the head of government in the UK and leads a Cabinet of senior ministers who are responsible for public policymaking and administering public services.","[0] United Kingdom - Wikipedia (https://en.wikipedia.org/wiki/United_Kingdom) [1] What Does the British Monarchy Actually Do? | TIME (https://time.com/6213624/what-does-british-monarchy-do/) [2] What's the Difference Between England, Britain and the U.K.? (https://www.smithsonianmag.com/smart-news/whats-difference-between-england-britain-and-uk-180959558/) [3] United Kingdom | History, Population, Map, Flag, Capital, & Facts (https://www.britannica.com/place/United-Kingdom) [4] Government of the United Kingdom - Wikipedia (https://en.wikipedia.org/wiki/Government_of_the_United_Kingdom)",government,public administration,policy making and public service administration
163,Peter Clutton-Brock,CEO,Yottar,"Yottar in the UK helps energy asset or construction developers understand where there is spare capacity on the electricity networks. They assist in locating optimal development locations for projects such as solar farms, battery assets, EV charging stations, and construction projects through their Yottar Connect platform.",[0] Yottar - find grid connections (https://www.yottar.tech/) [1] Top 3 priorities to accelerate grid connections - LinkedIn (https://www.linkedin.com/pulse/top-3-priorities-accelerate-grid-connections-yottar-4mtxe) [2] Here's how Yottaball works now compared to the old prizes (https://www.reddit.com/r/yotta/comments/1bcn3eb/heres_how_yottaball_works_now_compared_to_the_old/) [3] Yottar | LinkedIn (https://www.linkedin.com/company/yottar) [4] PDF Balance Flex Markets Unlocked (https://assets-global.website-files.com/653285dea9cbfd77d304b02b/662d313e7728968b7a0da448_Feasibility Report - Yottar Balance - with graphics.pdf),technology platform,energy and construction,network capacity analysis and optimization for renewable energy projects
164,Phill Davies,Co-Founder & CEO,Magway,"Magway in the UK operates an autonomous goods transportation system that utilizes linear motors to propel carriages along tracks. This innovative e-commerce delivery system aims to revolutionize the transport industry with a sustainable and efficient solution, reducing road congestion and air pollution. Magway's technology allows for high throughput, equivalent to two heavy goods vehicles per minute, and is designed to transport goods in pods through underground and overground pipes.",[0] Magway: Is this underground tunnel network the future of delivery ... (https://www.standard.co.uk/futurelondon/cleanair/magway-underground-tunnels-delivery-courier-a4309971.html) [1] Magway | We are on a mission to revolutionise the transport industry (https://www.magway.com/company) [2] Magway | Sustainable goods transport (https://www.magway.com/) [3] Magway Ltd - Wikipedia (https://en.wikipedia.org/wiki/Magway_Ltd) [4] Magway: Is Maglev Technology the Future of Low Carbon Home ... - RESET (https://en.reset.org/magway-is-maglev-technology-the-future-of-low-carbon-home-delivery/),startup,e-commerce delivery and transportation,autonomous goods transportation using linear motors and underground pipe systems
165,Raphaël de Ry,Co-Founder & CEO,ALLCOT IO,ALLCOT IO in the UK focuses on supporting companies in developing carbon projects that benefit local communities by leveraging digital technologies to combat climate change. They emphasize fairness and equity within the carbon market by advocating for green accounting practices and digital traceability to make a tangible impact on environmental and social outcomes.,"[0] ALLCOT IO | ALLCOT Marketplace (https://www.allcot.com/allcot-solutions/allcot-io/) [1] About us | Allcot.io (https://allcot.io/about-us/) [2] Allcot.io | On-chain carbon projects (https://allcot.io/) [3] ALLCOT IO, launching as ALLCOT's new division | ALLCOT (https://allcotnews.com/press-release/allcot-io-new-allcot-division-on-chain-carbon-projec/) [4] ALLCOT IO | LinkedIn (https://www.linkedin.com/company/allcot-io/)",division of a larger company,carbon markets and climate change,digital technologies for carbon project development and green accounting practices
