,person,role,organisation,company_summary,source_text,organisation_type,industry_domain,functional_expertise
0,Stephen Murphy,Founder,ClimateImpact,"ClimateImpact in the UK focuses on monitoring and addressing the impacts of climate change in the UK. This includes highlighting how climate change is causing warming across the UK, leading to more frequent and severe hot spells, which can have significant effects on public health, particularly impacting the elderly population. Additionally, the organization emphasizes the importance of understanding the difference between 1.5°C and 2°C of global warming and how it can vary based on the climate of the area and the wealth of the country.","[0] Climate change in the UK - Met Office (https://www.metoffice.gov.uk/weather/climate-change/climate-change-in-the-uk) [1] Six things the UK could do to tackle climate change - BBC News (https://www.bbc.co.uk/news/business-58885545) [2] The UK's climate is changing. What is driving this? How is the UK ... (https://climate-change.data.gov.uk/articles/uk-climate-is-changing) [3] UK must 'go much wider' with climate action, warn advisers (https://www.ft.com/content/bc20ab6e-dd86-4387-b47c-6f0945694614) [4] Effects of climate change - Met Office (https://www.metoffice.gov.uk/weather/climate-change/effects-of-climate-change)",non-profit organization,climate change monitoring and advocacy,climate impact assessment and public health analysis
1,Charlie Mercer,Deputy Policy Director,Startup Coalition,The Startup Coalition in the UK works to make policy better for tech startups and scaleups by providing detailed solutions to the challenges faced by startups when setting up and growing. They focus on ensuring the UK has the right incentives for founders starting up and a robust VC market for scaling up. They also advocate for regulations that enable startup founders to innovate in various tech sectors. The organization collaborates with digital startups and policymakers to create policies that support the digital economy.,[0] Startup Coalition (https://startupcoalition.io/) [1] Our Work — Startup Coalition (https://startupcoalition.io/our-work/) [2] Startup Coalition | LinkedIn (https://uk.linkedin.com/company/startup-coalition) [3] The 2022 Tech Startup Manifesto — Startup Coalition (https://startupcoalition.io/news/the-2022-tech-startup-manifesto/) [4] Team — Startup Coalition (https://startupcoalition.io/team/),advocacy organization,technology startups and scaleups,policy development and advocacy for tech innovation
2,Alyssa Gilbert,Director of Innovation,Grantham Institute,"The Grantham Institute in the UK is a multidisciplinary institute situated at the heart of Imperial College London and the London School of Economics and Political Science. Established in 2007 and 2008, respectively, the institute focuses on climate change and the environment, conducting policy-relevant research, providing education, training future leaders, and communicating academic knowledge to businesses, industry, and policymakers to influence decision-making.",[0] Grantham Institute - Climate Change and the Environment (https://www.imperial.ac.uk/grantham/) [1] About the Institute - Grantham Research Institute on climate change and ... (https://www.lse.ac.uk/GranthamInstitute/about/about-the-institute/) [2] About us | Grantham Institute - Climate Change and the Environment ... (https://www.imperial.ac.uk/grantham/about-us/) [3] Grantham Institute - Climate Change and Environment (https://en.wikipedia.org/wiki/Grantham_Institute_–_Climate_Change_and_Environment) [4] Grantham Institute (https://granthaminstitute.com/),multidisciplinary research institute,climate change and environmental policy,policy-relevant research and education on climate change
3,Sarah Mackintosh,Director,Cleantech for UK,"Cleantech for UK is an initiative that aims to pave the way for a new generation of global cleantech champions in the UK. The coalition includes members from accelerators, venture capital, growth investors, and alternative asset platforms with combined funds of over £6 billion. The initiative focuses on fostering green innovation and technology in the cleantech sector to drive the transition towards a more eco-friendly and technologically advanced society.",[0] Cleantech for UK (https://www.cleantechforuk.com/) [1] About us - Cleantech for UK (https://www.cleantechforuk.com/about-us) [2] Cleantech Leaders and Start-up Companies Unite to Launch Cleantech for ... (https://www.cleantech.com/release/cleantech-leaders-and-start-up-companies-unite-to-launch-cleantech-for-uk-supported-by-breakthrough-energy/) [3] What is the Cleantech for UK Initiative? (https://www.azocleantech.com/article.aspx?ArticleID=1811) [4] Bill Gates and Prime Minister launch new UK cleantech coalition at ... (https://www.imperial.ac.uk/news/243153/bill-gates-prime-minister-launch-uk/),initiative,cleantech,green innovation and technology
4,Sammy Fry,Head of Climate,Tech Nation,"Tech Nation in the UK is a leading growth platform that provides tech insights, connections, collaboration, and talent support to ambitious founders and their teams. It empowers tech startups from seed stage to success story by offering access to knowledge and resources. Additionally, Tech Nation plays a crucial role in shaping the UK's tech ecosystem, driving economic growth, creating jobs, and fostering innovation and entrepreneurship.","[0] Global Talent Visa | Tech Nation (https://technation.io/global-talent-visa/) [1] > UK Tech in the Age of AI - Tech Nation Report 2024 (https://technation.foleon.com/research/tech-nation-report-2024/) [2] Tech Nation | The UK network for ambitious tech entrepreneurs (https://technation.io/) [3] Tech Nation's 2024 report gives AI the spotlight, exploring 'UK Tech in ... (https://www.techuk.org/resource/tech-nation-s-2024-report-gives-the-spotlight-exploring-uk-tech-in-the-age-of-ai.html) [4] What is Tech Nation: Catalyzing the UK's Tech Growth and Global Talent ... (https://www.technomads.io/guides/what-is-tech-nation-catalyzing-the-uks-tech-growth-and-global-talent-attraction)",growth platform,technology,"supporting tech startups with insights, connections, and resources"
5,Sophia Kesteven,General Manager,Tech Zero,Tech Zero in the UK is a group for tech companies committed to climate action. It was initiated by a consortium of leading tech companies with the aim of accelerating progress towards achieving net zero emissions. Companies who join Tech Zero commit to measuring their emissions and setting ambitious net zero targets within a year of joining. The group provides access to exclusive events with climate experts and support from climate-tech scaleups to help companies reduce their emissions.,[0] Launching the Tech Zero Taskforce - GOV.UK (https://www.gov.uk/government/speeches/launching-the-tech-zero-taskforce) [1] Tech Zero (https://techzero.technation.io/) [2] About Tech Zero - Tech Nation (https://techzero.technation.io/about) [3] UK Tech aims to take on the climate crisis with Tech Zero taskforce (https://tech.eu/2021/03/01/uk-tech-takes-on-climate-crisis-with-tech-zero-taskforce) [4] About - Tech Zero - Medium (https://medium.com/@techzero/about),group of tech companies,climate action,emission measurement and net zero target setting
6,Craig Melson,"Associate Director for Climate, Environment & Sustainability",techUK,"techUK is a trade association in the UK that brings together individuals, companies, and organizations to harness the positive outcomes of digital technology. With around 1,000 members, including a majority of SMEs, techUK aims to create a network for innovation and collaboration across business, government, and stakeholders to advance a better future for people, society, the economy, and the planet. Some key activities of techUK include championing its members and their technologies, shaping policy, accelerating innovation, and developing markets in the technology sector.",[0] About us - techUK (https://www.techuk.org/who-we-are/about-us.html) [1] A UK Tech Plan: How the next Government can use technology to build a ... (https://www.techuk.org/resource/a-uk-tech-plan-how-the-next-government-can-use-technology-to-build-a-better-britain.html) [2] techUK | LinkedIn (https://www.linkedin.com/company/techuk) [3] Executive interview: TechUK CEO Julian David on 10 years of change in UK IT (https://www.computerweekly.com/news/366559259/Executive-interview-TechUK-CEO-Julian-David-on-10-years-of-change-in-UK-IT) [4] techUK's 2023: A Year in Review - LinkedIn (https://www.linkedin.com/pulse/techuks-2023-year-review-techuk-baenf),trade association,digital technology,"innovation, policy shaping, market development"
7,Abbie Morris,Co-Founder & CEO,Compare Ethics,"Compare Ethics in the UK is a Product Intelligence and Compliance platform founded by Abbie Morris. It enables businesses to manage, verify, and communicate product impact claims at scale. Abbie Morris, along with her co-founder James Omisakin, focuses on helping businesses navigate ethical considerations in their product offerings.","[0] The UK's most ethical banks and building societies (https://good-with-money.com/2024/04/03/the-uks-most-ethical-banks-and-building-societies/) [1] What does the UK think is right and wrong? The BBC reveals a snapshot ... (https://www.bbc.co.uk/mediacentre/latestnews/2019/year-of-beliefs-morality-ethics-survey-2019) [2] Q&A with Abbie Moris, CEO @ Compare Ethics | Content Hub (https://women-in-technology.com/content-hub/article/qa-with-abbie-moris-ceo-compare-ethics/) [3] The Fund Founder Spotlight Interview: Abbie Morris of Compare Ethics (https://ideas.thefund.vc/p/compare-ethics-abbie-morris) [4] Ethical banking in the UK: Which banks are most ethical? - Choose (https://www.choose.co.uk/guide/ethical-banking-explained.html)",Product Intelligence and Compliance platform,Ethical business practices,"Managing, verifying, and communicating product impact claims"
8,Abiel Ma,Co-Founder & CEO,Vuala,Vuala in the UK is an engineering biology company that specializes in making food waste recycling easy through their automatic food waste separation technology. Their focus is on shifting the traditional approach to food waste treatment to the initial stage of waste production within the supply chain. Their goal is to help the UK become a global leader in food waste recycling.,[0] About | Vuala (https://www.vuala.co.uk/about) [1] Home | Vuala (https://www.vuala.co.uk/) [2] FAQ | Vuala (https://www.vuala.co.uk/faq) [3] VUALA | UNICEF Office of Innovation (https://www.unicef.org/innovation/climate/innovation-30/vuala) [4] What is Vuala and how does it work? - vualapp.com (https://vualapp.com/blog-post/what-is-vuala-and-how-does-it-work),engineering biology company,food waste recycling,automatic food waste separation technology
9,Adam Fudakowski,Founder & Executive Director,Switchee Limited,"Switchee Limited in the UK improves the quality of life for people living in rented homes by providing real-time data insights to social housing providers. They empower housing providers to make informed decisions, optimize property performance, reduce costs, and improve resident satisfaction through the use of Internet of Things (IoT) technology. Switchee was founded in 2015 and is now the market leader in social housing IoT, serving many of the largest housing associations in the UK.",[0] About Switchee | The story behind our solution (https://switchee.com/overview/) [1] Why Switchee? | The data-led choice (https://switchee.com/why-switchee/) [2] Switchee | Data-driven property insights for housing providers (https://switchee.com/) [3] Switchee - Crunchbase Company Profile & Funding (https://www.crunchbase.com/organization/switchee) [4] Switchee | LinkedIn (https://uk.linkedin.com/company/switchee-limited),technology company,social housing,Internet of Things (IoT) technology for data insights and property performance optimization
10,Aditya Divecha,Founder & CEO,ADT - Adventure Driven Threads,"ADT - Adventure Driven Threads in the UK is a platform dedicated to promoting sustainable living by empowering individuals and brands to embrace eco-conscious practices. They offer tailored solutions for sustainable branding, marketing, and connect businesses with ethical branding solutions. ADT aims to redefine the narrative of sustainability through their platform.",[0] ADT - Adventure driven Threads | business solutions (https://www.adventuredriventhreads.co.uk/) [1] About Us | ADT Community - adventuredriventhreads.co.uk (https://www.adventuredriventhreads.co.uk/about-3) [2] ADT - Adventure Driven Threads | LinkedIn (https://uk.linkedin.com/company/adventuredriventhreads) [3] Adventure Driven Threads (ADT): Blending Ethical Choices with the ... (https://www.linkedin.com/pulse/adventure-driven-threads-adt-blending-ethical-choices) [4] ADT - Adventure Driven Threads' Post - LinkedIn (https://www.linkedin.com/posts/adventuredriventhreads_adventure-driven-threads-adt-blending-activity-7114930494781181952-mwfE),platform,sustainable living,sustainable branding and marketing solutions
11,Agnes Czako,Founder & CEO,Airex,"Airex in the UK provides smart passive ventilation systems that regulate air flow in homes to improve thermal efficiency, prevent damp, and enhance air quality. The system utilizes sensors to monitor temperature, humidity, and air quality, adjusting airflow accordingly. Airex aims to reduce heating energy demand, save on energy bills, and enhance thermal comfort for residents.",[0] Introducing AirEX - All your smart air brick questions answered (https://www.smartstoneenergy.co.uk/introducing-airex-all-your-smart-air-brick-questions-answered/) [1] Airex Smart Ventilation Control (https://www.airex.tech/) [2] Airex Smart Air Bricks: How it Works — Airex (https://www.airex.tech/how-airex-works) [3] Frequently Asked Questions — Airex (https://www.airex.tech/smart-air-brick-faqs) [4] AirEx | London City Hall (https://www.london.gov.uk/programmes-and-strategies/environment-and-climate-change/better-futures/airex),technology company,smart home ventilation,smart passive ventilation systems utilizing sensors for air quality and thermal efficiency
12,Aleksi Tukiainen,CEO & Co-founder,ClimateAligned,"ClimateAligned in the UK focuses on issues related to climate change, including the impact of extreme weather events, carbon taxation, and the importance of capturing and storing carbon emissions to achieve net zero emissions. The organization is concerned with the UK's warming trends, the need for rapid acceleration in deploying public charging points for electric vehicles, and the country's struggle to meet its climate targets.",[0] Six things the UK could do to tackle climate change - BBC News (https://www.bbc.co.uk/news/business-58885545) [1] Climate change: Is the UK on track to meet its net zero targets? (https://www.bbc.co.uk/news/58160547) [2] PDF How the UK can better manage a rapidly changing environment (https://www.instituteforgovernment.org.uk/sites/default/files/2024-03/adapting-to-climate-change_0.pdf) [3] The UK's climate is changing. What is driving this? How is the UK ... (https://climate-change.data.gov.uk/articles/uk-climate-is-changing) [4] Four crucial climate targets the new UK government ... - The Conversation (https://theconversation.com/four-crucial-climate-targets-the-new-uk-government-should-adopt-immediately-232327),non-profit organization,climate change advocacy,climate policy analysis and carbon management
13,Alan Chang,Founder,Fuse Energy,"Fuse Energy in the UK is an energy supplier regulated by Ofgem, offering electricity tariffs that are claimed to be the cheapest in the UK market. They provide both residential and business energy solutions, with a focus on competitive pricing and innovative tariff structures. Additionally, Fuse Energy has launched an electricity-only tariff with lower standing charges, making it particularly attractive for lower energy users. The company also aims to incorporate renewable energy sources such as solar farms and wind farms into their energy supply.","[0] Fuse Energy · Switch to the UK's cheapest electricity supplier (https://www.fuseenergy.com/) [1] Fuse Energy: here's what we know about this new supplier (https://www.which.co.uk/news/article/fuse-energy-should-you-switch-to-the-new-cheap-energy-supplier-a9UEr1k5axdO) [2] New supplier Fuse Energy launches electricity deal that undercuts the ... (https://www.moneysavingexpert.com/news/2023/07/fuse-energy-launches-electricity-only-deal/) [3] Learn more about Fuse Energy, the UK's cheapest electricity supplier (https://www.fuseenergy.com/about-us.html) [4] Fuse Energy Launches as New UK Supplier With Lowest Electricity Prices (https://www.energyvoice.com/renewables-energy-transition/519403/fuse-energy-launches/)",energy supplier,energy supply,competitive pricing and innovative tariff structures with a focus on renewable energy sources
14,Albert Howard,Head of Sustainability,Sourceful,"Sourceful in the UK is a packaging platform for climate-conscious brands. They work with businesses to design, produce, and manage more sustainable packaging solutions. Their mission is to use science and data to create the packaging the world needs, with a focus on choice, flexibility, responsible sourcing, and carbon removal to reduce environmental impact. Sourceful has a verified network of manufacturing partners across four continents who meet their high sustainability standards.",[0] Our Story | Our Values & The Sourceful Standard | Sourceful (https://www.sourceful.com/our-story) [1] Sustainable & Custom Packaging Suppliers | Sourceful (https://www.sourceful.com/) [2] Betting big on Manchester: why we are building Sourceful in the World's ... (https://www.sourceful.com/blog/betting-big-on-manchester-why-we-are-building-sourceful-in-the-worlds-original-industrialised-city) [3] How Sourceful is making businesses more sustainable and less polluting ... (https://www.independent.co.uk/independentpremium/business/sourceful-business-sustainable-logistics-packaging-b1949832.html) [4] Sourceful | LinkedIn (https://uk.linkedin.com/company/sourceful-com),packaging platform,sustainable packaging,"designing, producing, and managing sustainable packaging solutions"
15,Dr Alberto Campanaro,Head of Plant Science,Zayndu,"Zayndu in the UK specializes in seed treatment and priming using cold plasma technology to create ActivatedAir™, which enhances seed health, increases germination rates, and accelerates plant growth cycles for controlled-environment agriculture growers. The company was founded in January 2019 and has been funded through limited debt finance, investment from the founders, and research conducted at Loughborough University.",[0] About Zayndu - Boosting plant health to increase yield (https://zayndu.com/about/) [1] Zayndu - Boosting plant health to increase yield (https://zayndu.com/) [2] How Zayndu is cleaning up seeds with non-toxic plasma tech - AFN (https://agfundernews.com/zayndu-startup-spotlight-how-zayndu-is-cleaning-up-seeds-with-non-toxic-plasma-tech) [3] Zayndu Ltd - Agri-TechE (https://www.agri-tech-e.co.uk/civi_member/zayndu-ltd/) [4] Zayndu Seed Cleaning Accelerates Salad Leaf Growing Cycle (https://www.agritechtomorrow.com/story/2021/11/zayndu-seed-cleaning-accelerates-salad-leaf-growing-cycle/13334/),startup,agriculture technology,seed treatment and priming using cold plasma technology
16,Alessa Berg,Founder & CEO,Top Tier Impact,"Top Tier Impact in the UK refers to the impact of the top two tiers of COVID-19 restrictions (tier two and tier three) on controlling the spread of the virus. These tiers involve measures such as banning mixing inside homes and imposing restrictions on pubs and restaurants. Recent data indicates that these top two tiers have had an impact in reducing infection rates, although there have been criticisms of the government's speed in moving areas up a tier when infection rates rise.",[0] Covid-19 tiers: Almost all of England facing tough virus rules (https://www.bbc.co.uk/news/uk-55086621) [1] Covid-19: Strengthened tier system for England after lockdown (https://www.bbc.co.uk/news/uk-55029401) [2] Covid: England's regional tiers to be set out - BBC News (https://www.bbc.co.uk/news/uk-55078888) [3] Covid-19: Strengthened tier system for England after lockdown - BBC (https://www.bbc.com/news/uk-55029401) [4] Covid tiers: Why are some areas facing tougher restrictions? - BBC (https://www.bbc.com/news/54523313),government health authority,public health and safety,epidemiology and infectious disease control
17,Alex Smith,Co-Founder and Partner,Future Plus,"FuturePlus in the UK is a sustainability and ESG management and reporting platform that has been selected by Atlas FM, a leading UK facilities management company, to support its sustainable ambitions and change its approach to sustainability and social impact.",[0] FuturePlus selected by UK wide facilities management company ... - Bdaily (https://bdaily.co.uk/articles/2023/06/06/futureplus-selected-by-uk-wide-facilities-management-company-to-support-sustainable-ambitions) [1] How will the UK economy compare to other countries in 2024? (https://www.bbc.co.uk/news/business-66269947) [2] UK's Future Plc sees profit at top end of market outlook (https://www.reuters.com/world/uk/uks-future-plc-sees-profit-top-end-market-outlook-2021-10-04/) [3] Future plc - Wikipedia (https://en.wikipedia.org/wiki/Future_plc) [4] Home to media brands that ignite passions - Future (https://futureplc.com/our-brands/),sustainability and ESG management platform,sustainability and social impact,"management and reporting of environmental, social, and governance metrics"
18,Alexander Lempka,CEO,Connect Earth,"Connect Earth in the UK is a company that operates as an environmental data startup based in London. They focus on building infrastructure for climate-conscious products to promote a world where climate action becomes a standard practice. Connect Earth has secured funding rounds to support their mission, with recent rounds raising €1.6 million and $1.8 million to power climate-conscious products. The company's primary focus lies in empowering the financial industry with white-label carbon accounting infrastructure to drive decarbonisation initiatives and offer carbon accounting-as-a-service solutions to clients.",[0] Connect Earth (https://connect.earth/) [1] Connect Earth | Carbon Footprint and Sustainability FAQs (https://connect.earth/faqs/) [2] Our Story | We're All About Carbon Tracking - Connect Earth (https://connect.earth/our-story/) [3] London's Connect Earth raises €1.6 million to power climate-conscious ... (https://www.eu-startups.com/2022/03/londons-connect-earth-raises-e1-6-million-to-power-climate-conscious-products/) [4] Connect Earth raises $1.8 million pre-seed round to power ... - Medium (https://medium.com/connect-earth/connect-earth-raises-1-8-million-pre-seed-round-to-power-climate-conscious-products-de699f975164),environmental data startup,climate action and carbon accounting,white-label carbon accounting infrastructure and carbon accounting-as-a-service solutions
19,Amaury van Trappen de Buggenoms,CEO & Co-founder,A&B Smart Materials,"A&B Smart Materials in the UK specializes in revolutionizing cooling technologies through the development of novel smart hydrogels. Their primary focus is on introducing a smart material coating that increases the power output of photovoltaic panels and extends their lifetime by passively cooling surfaces it is applied to. This technology aims to address overheating issues in solar farms, ultimately maximizing energy generation efficiency.","[0] A&B Smart Materials Company Profile 2024: Valuation, Funding ... (https://pitchbook.com/profiles/company/522866-08) [1] A&B Smart Materials | LinkedIn (https://uk.linkedin.com/company/a-b-smart-materials) [2] A&B Smart Materials (https://www.absmartmaterials.com/) [3] A&B Smart Materials | F6S (https://www.f6s.com/company/ab-smart-materials) [4] A&B Smart Materials | Portfolio | Entrepreneur First (https://www.joinef.com/companies/ab-smart-materials/)",startup,cooling technologies and renewable energy,development of smart hydrogels for passive cooling of photovoltaic panels
20,Anand Verma,Founder + CEO,ExpectAI,"ExpectAI in the UK is a London-based Climate AI Platform founded by Anand, who is also the CEO. The company is dedicated to helping businesses decarbonize profitably by leveraging the power of data and AI. ExpectAI offers services such as building carbon profiles for companies, facilitating collaboration, providing access to a knowledge base, and connecting businesses with verified partners to aid in their decarbonization journey. Their platform aims to assist business leaders in taking carbon actions to reduce emissions and combat climate change.","[0] About Us - ExpectAI™ - Decarbonise, Profitably. (https://www.expectai.com/about) [1] ExpectAI™ - A company can lower their emissions by leveraging data and A.I. (https://www.expectai.com/post/a-company-can-lower-their-emissions-by-leveraging-data-and-ai) [2] ExpectAI™ - Accelerate your journey to Net Zero with Data & AI (https://www.expectai.com/) [3] ExpectAI | LinkedIn (https://www.linkedin.com/company/expectai) [4] ExpectAI on LinkedIn: About Us - ExpectAI™ - Decarbonise, Profitably. (https://www.linkedin.com/posts/expectai_about-us-expectai-decarbonise-profitably-activity-7171912526371233792-zzO4)",Climate AI Platform,decarbonization and climate change,data analytics and artificial intelligence for carbon management
